"decision_key","decision","canonical_suggestion","suggested_pattern","sponsor_a","sponsor_b","total_n","similarity_score","decided_at","notes"
"centre hospitalier regional universitaire ||| centre hospitalier universitaire de liege ||| centre hospitalier regional universitaire ||| centre hospitalier universitaire de liege","skipped","Centre Hospitalier Regional Universitaire","Centre Hospitalier Universitaire De Liege","Centre Hospitalier Regional Universitaire","Centre Hospitalier Universitaire De Liege",23,0.605,"2026-05-05 20:38:01 +0200","Skipped interactively"
"azienda ospedaliero universitaria ospedali riuniti umberto i - g.m.lancisi - g.salesi ||| azienda ospedaliero universitaria pisana ||| azienda ospedaliero universitaria ospedali riuniti umberto i - g.m.lancisi - g.salesi ||| azienda ospedaliero universitaria pisana","skipped","AZIENDA OSPEDALIERO UNIVERSITARIA OSPEDALI RIUNITI UMBERTO I - G.M.LANCISI - G.SALESI","Azienda Ospedaliero Universitaria Pisana","AZIENDA OSPEDALIERO UNIVERSITARIA OSPEDALI RIUNITI UMBERTO I - G.M.LANCISI - G.SALESI","Azienda Ospedaliero Universitaria Pisana",23,0.481,"2026-05-05 20:38:03 +0200","Skipped interactively"
"fondazione gimema franco mandelli onlus ||| fondazione gimema gruppo italiano malattie ematologiche dell adulto franco mandelli onlus ||| fondazione gimema franco mandelli onlus ||| fondazione gimema gruppo italiano malattie ematologiche dell adulto franco mandelli onlus","skipped","Fondazione Gimema Franco Mandelli Onlus","Fondazione Gimema Gruppo Italiano Malattie Ematologiche Dell Adulto Franco Mandelli Onlus","Fondazione Gimema Franco Mandelli Onlus","Fondazione Gimema Gruppo Italiano Malattie Ematologiche Dell Adulto Franco Mandelli Onlus",23,0.438,"2026-05-05 20:38:05 +0200","Skipped interactively"
"cancer ||| institute of cancer ||| cancer ||| institute of cancer","skipped","Cancer","Institute Of Cancer","Cancer","Institute Of Cancer",23,0.375,"2026-05-05 20:38:06 +0200","Skipped interactively"
"fundacin progreso y salud ||| fundacin pblica andaluza para la investigacin de mlaga en biomedicina y salud fimabis ||| fundacin progreso y salud ||| fundacin pblica andaluza para la investigacin de mlaga en biomedicina y salud fimabis","skipped","Fundacin Progreso Y Salud","Fundacin Pblica Andaluza Para La Investigacin De Mlaga En Biomedicina Y Salud Fimabis","Fundacin Progreso Y Salud","Fundacin Pblica Andaluza Para La Investigacin De Mlaga En Biomedicina Y Salud Fimabis",23,0.278,"2026-05-05 20:38:08 +0200","Skipped interactively"
"hopital erasme ||| erasme hospital ||| hopital erasme ||| erasme hospital","approved","Hopital Erasme","Erasme Hospital","Hopital Erasme","Erasme Hospital",23,0.067,"2026-05-05 20:38:10 +0200",""
"cancer ||| europese organisatie voor onderzoek en behandeling van kanker organisation europeenne pour la recherche et le traitement du cancer organi ||| cancer ||| europese organisatie voor onderzoek en behandeling van kanker organisation europeenne pour la recherche et le traitement du cancer organi","skipped","Cancer","Europese Organisatie Voor Onderzoek En Behandeling Van Kanker Organisation Europeenne Pour La Recherche Et Le Traitement Du Cancer Organi","Cancer","Europese Organisatie Voor Onderzoek En Behandeling Van Kanker Organisation Europeenne Pour La Recherche Et Le Traitement Du Cancer Organi",23,0.046,"2026-05-05 20:38:12 +0200","Skipped interactively"
"azienda ospedaliera universitaria careggi ||| azienda ospedaliero universitaria di cagliari ||| azienda ospedaliera universitaria careggi ||| azienda ospedaliero universitaria di cagliari","skipped","Azienda Ospedaliera Universitaria Careggi","Azienda Ospedaliero Universitaria Di Cagliari","Azienda Ospedaliera Universitaria Careggi","Azienda Ospedaliero Universitaria Di Cagliari",22,0.857,"2026-05-05 20:38:14 +0200","Skipped interactively"
"universittsklinikum mnster ||| universittsklinikum wrzburg ||| universittsklinikum mnster ||| universittsklinikum wrzburg","skipped","Universittsklinikum Mnster","Universittsklinikum Wrzburg","Universittsklinikum Mnster","Universittsklinikum Wrzburg",22,0.778,"2026-05-05 20:38:15 +0200","Skipped interactively"
"gentofte hospital ||| herlev and gentofte hospital ||| gentofte hospital ||| herlev and gentofte hospital","approved","Gentofte Hospital","Herlev And Gentofte Hospital","Gentofte Hospital","Herlev And Gentofte Hospital",22,0.708,"2026-05-05 20:38:17 +0200",""
"university of oxford ||| oxford university hospitals nhs trust ||| university of oxford ||| oxford university hospitals nhs trust","skipped","University Of Oxford","Oxford University Hospitals Nhs Trust","University Of Oxford","Oxford University Hospitals Nhs Trust",148,0.462,"2026-05-05 20:39:01 +0200","Skipped interactively"
"odense university hospital ||| odense universitetshospital ||| odense university hospital ||| odense universitetshospital","approved","Odense University Hospital","Odense Universitetshospital","Odense University Hospital","Odense Universitetshospital",111,0.889,"2026-05-05 20:39:03 +0200",""
"centre hospitalier regional de marseille ||| centre hospitalier regional universitaire de tours ||| centre hospitalier regional de marseille ||| centre hospitalier regional universitaire de tours","skipped","Centre Hospitalier Regional De Marseille","Centre Hospitalier Regional Universitaire De Tours","Centre Hospitalier Regional De Marseille","Centre Hospitalier Regional Universitaire De Tours",56,0.682,"2026-05-05 20:39:06 +0200","Skipped interactively"
"centre hospitalier regional de marseille ||| centre hospitalier regional et universitaire de brest ||| centre hospitalier regional de marseille ||| centre hospitalier regional et universitaire de brest","skipped","Centre Hospitalier Regional De Marseille","Centre Hospitalier Regional Et Universitaire De Brest","Centre Hospitalier Regional De Marseille","Centre Hospitalier Regional Et Universitaire De Brest",44,0.66,"2026-05-05 20:39:07 +0200","Skipped interactively"
"consorci mar parc de salut de barcelona parc de salut mar ||| parc de salut mar ||| consorci mar parc de salut de barcelona parc de salut mar ||| parc de salut mar","approved","Consorci Mar Parc De Salut De Barcelona Parc De Salut Mar","Parc De Salut Mar","Consorci Mar Parc De Salut De Barcelona Parc De Salut Mar","Parc De Salut Mar",42,0.292,"2026-05-05 20:39:18 +0200",""
"universittsklinikum essen ||| universittsklinikum mnster ||| universittsklinikum essen ||| universittsklinikum mnster","skipped","Universittsklinikum Essen","Universittsklinikum Mnster","Universittsklinikum Essen","Universittsklinikum Mnster",39,0.846,"2026-05-05 20:39:19 +0200","Skipped interactively"
"universittsklinikum essen ||| universittsklinikum ulm ||| universittsklinikum essen ||| universittsklinikum ulm","skipped","Universittsklinikum Essen","Universittsklinikum Ulm","Universittsklinikum Essen","Universittsklinikum Ulm",38,0.8,"2026-05-05 20:39:21 +0200","Skipped interactively"
"central manchester university hospitals nhs foundation trust ||| the university of manchester ||| central manchester university hospitals nhs foundation trust ||| the university of manchester","skipped","Central Manchester University Hospitals Nhs Foundation Trust","The University Of Manchester","Central Manchester University Hospitals Nhs Foundation Trust","The University Of Manchester",31,0.263,"2026-05-05 20:39:25 +0200","Skipped interactively"
"central manchester university hospitals nhs foundation trust ||| university hospital of south manchester nhs foundation trust ||| central manchester university hospitals nhs foundation trust ||| university hospital of south manchester nhs foundation trust","skipped","Central Manchester University Hospitals Nhs Foundation Trust","University Hospital Of South Manchester Nhs Foundation Trust","Central Manchester University Hospitals Nhs Foundation Trust","University Hospital Of South Manchester Nhs Foundation Trust",31,0.158,"2026-05-05 20:39:28 +0200","Skipped interactively"
"hopital erasme ||| hpital erasme ||| hopital erasme ||| hpital erasme","approved","Hopital Erasme","Hpital Erasme","Hopital Erasme","Hpital Erasme",30,0.867,"2026-05-05 20:39:29 +0200",""
"centre hospitalier regional et universitaire de brest ||| centre hospitalier universitaire de reims ||| centre hospitalier regional et universitaire de brest ||| centre hospitalier universitaire de reims","skipped","Centre Hospitalier Regional Et Universitaire De Brest","Centre Hospitalier Universitaire De Reims","Centre Hospitalier Regional Et Universitaire De Brest","Centre Hospitalier Universitaire De Reims",22,0.66,"2026-05-05 20:39:31 +0200","Skipped interactively"
"centre hospitalier regional et universitaire de brest ||| centre hospitalier universitaire de besanon ||| centre hospitalier regional et universitaire de brest ||| centre hospitalier universitaire de besanon","skipped","Centre Hospitalier Regional Et Universitaire De Brest","Centre Hospitalier Universitaire De Besanon","Centre Hospitalier Regional Et Universitaire De Brest","Centre Hospitalier Universitaire De Besanon",22,0.638,"2026-05-05 20:39:32 +0200","Skipped interactively"
"centre hospitalier regional et universitaire de brest ||| centre hospitalier universitaire de nancy ||| centre hospitalier regional et universitaire de brest ||| centre hospitalier universitaire de nancy","skipped","Centre Hospitalier Regional Et Universitaire De Brest","Centre Hospitalier Universitaire De Nancy","Centre Hospitalier Regional Et Universitaire De Brest","Centre Hospitalier Universitaire De Nancy",22,0.638,"2026-05-05 20:39:33 +0200","Skipped interactively"
"centre hospitalier regional et universitaire de brest ||| centre hospitalier universitaire brugmann ||| centre hospitalier regional et universitaire de brest ||| centre hospitalier universitaire brugmann","skipped","Centre Hospitalier Regional Et Universitaire De Brest","Centre Hospitalier Universitaire Brugmann","Centre Hospitalier Regional Et Universitaire De Brest","Centre Hospitalier Universitaire Brugmann",22,0.617,"2026-05-05 20:39:34 +0200","Skipped interactively"
"oulu university hospital ||| university of oulu ||| oulu university hospital ||| university of oulu","skipped","Oulu University Hospital","University Of Oulu","Oulu University Hospital","University Of Oulu",22,0.5,"2026-05-05 20:39:37 +0200","Skipped interactively"
"university of tartu ||| tartu university hospital ||| university of tartu ||| tartu university hospital","skipped","University Of Tartu","Tartu University Hospital","University Of Tartu","Tartu University Hospital",22,0.48,"2026-05-05 20:39:40 +0200","Skipped interactively"
"allergopharma joachim ganzer ||| allergopharma ||| allergopharma joachim ganzer ||| allergopharma","approved","Allergopharma Joachim Ganzer","Allergopharma","Allergopharma Joachim Ganzer","Allergopharma",22,0.464,"2026-05-05 20:39:42 +0200",""
"hospital universitario la paz ||| fundacion para la investigacion biomedica del hospital universitario la paz ||| hospital universitario la paz ||| fundacion para la investigacion biomedica del hospital universitario la paz","approved","Hospital Universitario La Paz","Fundacion Para La Investigacion Biomedica Del Hospital Universitario La Paz","Hospital Universitario La Paz","Fundacion Para La Investigacion Biomedica Del Hospital Universitario La Paz",22,0.442,"2026-05-05 20:39:46 +0200",""
"abcsg austrian breast colorectal cancer study ||| breast cancer study ibcsg ||| abcsg austrian breast colorectal cancer study ||| breast cancer study ibcsg","skipped","Abcsg Austrian Breast Colorectal Cancer Study","Breast Cancer Study Ibcsg","Abcsg Austrian Breast Colorectal Cancer Study","Breast Cancer Study Ibcsg",22,0.289,"2026-05-05 20:39:51 +0200","Skipped interactively"
"cancer ||| ludwig institute for cancer ||| cancer ||| ludwig institute for cancer","skipped","Cancer","Ludwig Institute For Cancer","Cancer","Ludwig Institute For Cancer",22,0.261,"2026-05-05 20:39:52 +0200","Skipped interactively"
"cancer ||| fdration nationale des centres de lutte contre le cancer ||| cancer ||| fdration nationale des centres de lutte contre le cancer","skipped","Cancer","Fdration Nationale Des Centres De Lutte Contre Le Cancer","Cancer","Fdration Nationale Des Centres De Lutte Contre Le Cancer",22,0.12,"2026-05-05 20:39:54 +0200","Skipped interactively"
"azienda ospedaliero universitaria di modena ||| azienda ospedaliero universitaria di cagliari ||| azienda ospedaliero universitaria di modena ||| azienda ospedaliero universitaria di cagliari","skipped","Azienda Ospedaliero Universitaria Di Modena","Azienda Ospedaliero Universitaria Di Cagliari","Azienda Ospedaliero Universitaria Di Modena","Azienda Ospedaliero Universitaria Di Cagliari",21,0.833,"2026-05-05 20:39:57 +0200","Skipped interactively"
"universittsklinikum ulm ||| universitaetsklinikum ulm aör ||| universittsklinikum ulm ||| universitaetsklinikum ulm aör","skipped","Universittsklinikum Ulm","Universitaetsklinikum Ulm Aör","Universittsklinikum Ulm","Universitaetsklinikum Ulm Aör",21,0.821,"2026-05-05 20:39:58 +0200","Skipped interactively"
"laboratorios alter ||| laboratorios salvat ||| laboratorios alter ||| laboratorios salvat","skipped","Laboratorios Alter","Laboratorios Salvat","Laboratorios Alter","Laboratorios Salvat",21,0.789,"2026-05-05 20:39:59 +0200","Skipped interactively"
"universittsklinikum ulm ||| universittsklinikum wrzburg ||| universittsklinikum ulm ||| universittsklinikum wrzburg","skipped","Universittsklinikum Ulm","Universittsklinikum Wrzburg","Universittsklinikum Ulm","Universittsklinikum Wrzburg",21,0.778,"2026-05-05 20:40:00 +0200","Skipped interactively"
"hal allergy ||| allergy ||| hal allergy ||| allergy","skipped","Hal Allergy","Allergy","Hal Allergy","Allergy",21,0.636,"2026-05-05 20:40:04 +0200","Skipped interactively"
"chu amiens ||| chu amiens-picardie ||| chu amiens ||| chu amiens-picardie","approved","Chu Amiens","Chu Amiens-Picardie","Chu Amiens","Chu Amiens-Picardie",21,0.526,"2026-05-05 20:40:08 +0200",""
"institut de cancerologie de l ouest ||| institut de cancerologie de louest ||| institut de cancerologie de l ouest ||| institut de cancerologie de louest","approved","Institut De Cancerologie De L Ouest","Institut De Cancerologie De Louest","Institut De Cancerologie De L Ouest","Institut De Cancerologie De Louest",20,0.966,"2026-05-05 20:40:09 +0200",""
"fundacin para la investigacin biomdica del hospital universitario la paz ||| fundacin para la investigacin biomdica del hospital gregorio maran ||| fundacin para la investigacin biomdica del hospital universitario la paz ||| fundacin para la investigacin biomdica del hospital gregorio maran","skipped","Fundacin Para La Investigacin Biomdica Del Hospital Universitario La Paz","Fundacin Para La Investigacin Biomdica Del Hospital Gregorio Maran","Fundacin Para La Investigacin Biomdica Del Hospital Universitario La Paz","Fundacin Para La Investigacin Biomdica Del Hospital Gregorio Maran",20,0.797,"2026-05-05 20:40:18 +0200","Skipped interactively"
"instituto de investigacin sanitaria la fe ||| instituto de investigacion sanitaria la fe ||| instituto de investigacin sanitaria la fe ||| instituto de investigacion sanitaria la fe","approved","Instituto De Investigacin Sanitaria La Fe","Instituto De Investigacion Sanitaria La Fe","Instituto De Investigacin Sanitaria La Fe","Instituto De Investigacion Sanitaria La Fe",19,0.972,"2026-05-05 20:40:21 +0200",""
"fdration francophone de cancrologie digestive ||| fdration francophone de cancrologie digestive ffcd ||| fdration francophone de cancrologie digestive ||| fdration francophone de cancrologie digestive ffcd","approved","Fdration Francophone De Cancrologie Digestive","Fdration Francophone De Cancrologie Digestive Ffcd","Fdration Francophone De Cancrologie Digestive","Fdration Francophone De Cancrologie Digestive Ffcd",19,0.894,"2026-05-05 20:40:23 +0200",""
"azienda ospedaliera universitaria careggi ||| azienda ospedaliero universitaria pisana ||| azienda ospedaliera universitaria careggi ||| azienda ospedaliero universitaria pisana","skipped","Azienda Ospedaliera Universitaria Careggi","Azienda Ospedaliero Universitaria Pisana","Azienda Ospedaliera Universitaria Careggi","Azienda Ospedaliero Universitaria Pisana",19,0.805,"2026-05-05 20:40:24 +0200","Skipped interactively"
"hellenic cooperative ||| hellenic cooperative hecog ||| hellenic cooperative ||| hellenic cooperative hecog","approved","Hellenic Cooperative","Hellenic Cooperative Hecog","Hellenic Cooperative","Hellenic Cooperative Hecog",19,0.769,"2026-05-05 20:40:26 +0200",""
"fundacin para la investigacin biomdica del hospital universitario la paz ||| fundacin para la investigacin biomdica de crdoba ||| fundacin para la investigacin biomdica del hospital universitario la paz ||| fundacin para la investigacin biomdica de crdoba","skipped","Fundacin Para La Investigacin Biomdica Del Hospital Universitario La Paz","Fundacin Para La Investigacin Biomdica De Crdoba","Fundacin Para La Investigacin Biomdica Del Hospital Universitario La Paz","Fundacin Para La Investigacin Biomdica De Crdoba",19,0.644,"2026-05-05 20:40:27 +0200","Skipped interactively"
"nycomed ||| nycomed aps ||| nycomed ||| nycomed aps","approved","Nycomed","Nycomed Aps","Nycomed","Nycomed Aps",19,0.636,"2026-05-05 20:40:29 +0200",""
"azienda ospedaliera universitaria careggi ||| azienda ospedaliera universitaria della seconda universita degli studi di napoli ||| azienda ospedaliera universitaria careggi ||| azienda ospedaliera universitaria della seconda universita degli studi di napoli","skipped","Azienda Ospedaliera Universitaria Careggi","Azienda Ospedaliera Universitaria Della Seconda Universita Degli Studi Di Napoli","Azienda Ospedaliera Universitaria Careggi","Azienda Ospedaliera Universitaria Della Seconda Universita Degli Studi Di Napoli",19,0.563,"2026-05-05 20:40:39 +0200","Skipped interactively"
"university hospital heidelberg ||| university hospital of heidelberg ||| university hospital heidelberg ||| university hospital of heidelberg","approved","University Hospital Heidelberg","University Hospital Of Heidelberg","University Hospital Heidelberg","University Hospital Of Heidelberg",18,1,"2026-05-05 20:40:42 +0200",""
"university of manchester ||| the university of manchester ||| university of manchester ||| the university of manchester","approved","University Of Manchester","The University Of Manchester","University Of Manchester","The University Of Manchester",18,1,"2026-05-05 20:40:44 +0200",""
"azienda ospedaliero universitaria di modena ||| azienda ospedaliero universitaria pisana ||| azienda ospedaliero universitaria di modena ||| azienda ospedaliero universitaria pisana","skipped","Azienda Ospedaliero Universitaria Di Modena","Azienda Ospedaliero Universitaria Pisana","Azienda Ospedaliero Universitaria Di Modena","Azienda Ospedaliero Universitaria Pisana",18,0.9,"2026-05-05 20:40:45 +0200","Skipped interactively"
"centre hospitalier universitaire de liege ||| centre hospitalier universitaire de poitiers ||| centre hospitalier universitaire de liege ||| centre hospitalier universitaire de poitiers","skipped","Centre Hospitalier Universitaire De Liege","Centre Hospitalier Universitaire De Poitiers","Centre Hospitalier Universitaire De Liege","Centre Hospitalier Universitaire De Poitiers",18,0.842,"2026-05-05 20:40:46 +0200","Skipped interactively"
"instituto de investigacin sanitaria la fe ||| instituto de investigacin sanitaria incliva ||| instituto de investigacin sanitaria la fe ||| instituto de investigacin sanitaria incliva","skipped","Instituto De Investigacin Sanitaria La Fe","Instituto De Investigacin Sanitaria Incliva","Instituto De Investigacin Sanitaria La Fe","Instituto De Investigacin Sanitaria Incliva",18,0.825,"2026-05-05 20:40:47 +0200","Skipped interactively"
"fundacin para la investigacin biomdica del hospital universitario la paz ||| fundacion para la investigacion biomedica del hospital universitario la paz ||| fundacin para la investigacin biomdica del hospital universitario la paz ||| fundacion para la investigacion biomedica del hospital universitario la paz","skipped","Fundacin Para La Investigacin Biomdica Del Hospital Universitario La Paz","Fundacion Para La Investigacion Biomedica Del Hospital Universitario La Paz","Fundacin Para La Investigacin Biomdica Del Hospital Universitario La Paz","Fundacion Para La Investigacion Biomedica Del Hospital Universitario La Paz",18,0.814,"2026-05-05 20:40:51 +0200","Skipped interactively"
"mitsubishi tanabe mtpc ||| mitsubishi tanabe ||| mitsubishi tanabe mtpc ||| mitsubishi tanabe","approved","Mitsubishi Tanabe Mtpc","Mitsubishi Tanabe","Mitsubishi Tanabe Mtpc","Mitsubishi Tanabe",18,0.773,"2026-05-05 20:40:52 +0200",""
"centre hospitalier universitaire de liege ||| centre hospitalier universitaire de caen normandie ||| centre hospitalier universitaire de liege ||| centre hospitalier universitaire de caen normandie","skipped","Centre Hospitalier Universitaire De Liege","Centre Hospitalier Universitaire De Caen Normandie","Centre Hospitalier Universitaire De Liege","Centre Hospitalier Universitaire De Caen Normandie",18,0.727,"2026-05-05 20:40:55 +0200","Skipped interactively"
"azienda ospedaliera universitaria careggi ||| azienda ospedaliera universitaria san martino genova ||| azienda ospedaliera universitaria careggi ||| azienda ospedaliera universitaria san martino genova","skipped","Azienda Ospedaliera Universitaria Careggi","Azienda Ospedaliera Universitaria San Martino Genova","Azienda Ospedaliera Universitaria Careggi","Azienda Ospedaliera Universitaria San Martino Genova",18,0.712,"2026-05-05 20:40:57 +0200","Skipped interactively"
"azienda ospedaliera arcispedale s. maria nuova ||| azienda ospedaliera arcispedale santa maria nuova/irccs di reggio emilia ||| azienda ospedaliera arcispedale s. maria nuova ||| azienda ospedaliera arcispedale santa maria nuova/irccs di reggio emilia","approved","Azienda Ospedaliera Arcispedale S. Maria Nuova","Azienda Ospedaliera Arcispedale Santa Maria Nuova/Irccs Di Reggio Emilia","Azienda Ospedaliera Arcispedale S. Maria Nuova","Azienda Ospedaliera Arcispedale Santa Maria Nuova/Irccs Di Reggio Emilia",18,0.652,"2026-05-05 20:41:01 +0200",""
"university of manchester ||| university hospital of south manchester nhs foundation trust ||| university of manchester ||| university hospital of south manchester nhs foundation trust","skipped","University Of Manchester","University Hospital Of South Manchester Nhs Foundation Trust","University Of Manchester","University Hospital Of South Manchester Nhs Foundation Trust",18,0.583,"2026-05-05 20:41:04 +0200","Skipped interactively"
"vall d hebron institute of ||| fundacio hospital universitari vall d’hebron institut de recerca ||| vall d hebron institute of ||| fundacio hospital universitari vall d’hebron institut de recerca","skipped","Vall D Hebron Institute Of","Fundacio Hospital Universitari Vall D’hebron Institut De Recerca","Vall D Hebron Institute Of","Fundacio Hospital Universitari Vall D’hebron Institut De Recerca",18,0.442,"2026-05-05 20:41:11 +0200","Skipped interactively"
"chiron ||| chiron behring ||| chiron ||| chiron behring","approved","Chiron","Chiron Behring","Chiron","Chiron Behring",18,0.429,"2026-05-05 20:41:13 +0200",""
"medisch spectrum twente ||| spectrum ||| medisch spectrum twente ||| spectrum","skipped","Medisch Spectrum Twente","Spectrum","Medisch Spectrum Twente","Spectrum",18,0.348,"2026-05-05 20:41:14 +0200","Skipped interactively"
"university hospital heidelberg ||| heidelberg university ||| university hospital heidelberg ||| heidelberg university","skipped","University Hospital Heidelberg","Heidelberg University","University Hospital Heidelberg","Heidelberg University",23,0.167,"2026-05-05 20:41:46 +0200","Skipped interactively"
"martin-luther-universitt halle-wittenberg ||| martin-luther-universitaet halle-wittenberg ||| martin-luther-universitt halle-wittenberg ||| martin-luther-universitaet halle-wittenberg","approved","Martin-Luther-Universitt Halle-Wittenberg","Martin-Luther-Universitaet Halle-Wittenberg","Martin-Luther-Universitt Halle-Wittenberg","Martin-Luther-Universitaet Halle-Wittenberg",17,0.953,"2026-05-05 20:41:50 +0200",""
"universittsklinikum freiburg ||| universittsklinikum wrzburg ||| universittsklinikum freiburg ||| universittsklinikum wrzburg","skipped","Universittsklinikum Freiburg","Universittsklinikum Wrzburg","Universittsklinikum Freiburg","Universittsklinikum Wrzburg",17,0.893,"2026-05-05 20:41:51 +0200","Skipped interactively"
"fundacin para la investigacin biomdica del hospital gregorio maran ||| fundacin para la investigacin biomdica de crdoba ||| fundacin para la investigacin biomdica del hospital gregorio maran ||| fundacin para la investigacin biomdica de crdoba","skipped","Fundacin Para La Investigacin Biomdica Del Hospital Gregorio Maran","Fundacin Para La Investigacin Biomdica De Crdoba","Fundacin Para La Investigacin Biomdica Del Hospital Gregorio Maran","Fundacin Para La Investigacin Biomdica De Crdoba",17,0.661,"2026-05-05 20:41:54 +0200","Skipped interactively"
"hopital foch ||| hospital foch ||| hopital foch ||| hospital foch","approved","Hopital Foch","Hospital Foch","Hopital Foch","Hospital Foch",16,1,"2026-05-05 20:42:00 +0200",""
"centre franois baclesse ||| centre francois baclesse ||| centre franois baclesse ||| centre francois baclesse","approved","Centre Franois Baclesse","Centre Francois Baclesse","Centre Franois Baclesse","Centre Francois Baclesse",16,0.958,"2026-05-05 20:42:01 +0200",""
