"decision_key","decision","canonical_suggestion","suggested_pattern","sponsor_a","sponsor_b","total_n","similarity_score","decided_at","notes"
"merck ||| merck serono ||| merck ||| merck serono","skipped","Merck","Merck Serono","Merck","Merck Serono",185,0.417,"2026-05-05 20:26:38 +0200","Skipped interactively"
"university college london ||| university college dublin ||| university college london ||| university college dublin","skipped","University College London","University College Dublin","University College London","University College Dublin",176,0.8,"2026-05-05 20:26:43 +0200","Skipped interactively"
"azienda ospedaliera di bologna policlinico s. orsola m. malpighi ||| azienda ospedaliera policlinico di modena ||| azienda ospedaliera di bologna policlinico s. orsola m. malpighi ||| azienda ospedaliera policlinico di modena","skipped","Azienda Ospedaliera Di Bologna Policlinico S. Orsola M. Malpighi","Azienda Ospedaliera Policlinico Di Modena","Azienda Ospedaliera Di Bologna Policlinico S. Orsola M. Malpighi","Azienda Ospedaliera Policlinico Di Modena",167,0.576,"2026-05-05 20:26:45 +0200","Skipped interactively"
"oslo university hospital ||| university of oslo ||| oslo university hospital ||| university of oslo","skipped","Oslo University Hospital","University Of Oslo","Oslo University Hospital","University Of Oslo",152,0.542,"2026-05-05 20:26:48 +0200","Skipped interactively"
"university of birmingham ||| university hospitals birmingham nhs foundation trust ||| university of birmingham ||| university hospitals birmingham nhs foundation trust","skipped","University Of Birmingham","University Hospitals Birmingham NHS Foundation Trust","University Of Birmingham","University Hospitals Birmingham NHS Foundation Trust",141,0.7,"2026-05-05 20:26:50 +0200","Skipped interactively"
"fondazione irccs istituto nazionale dei tumori ||| istituto nazionale per lo studio e la cura dei tumori - fondazione g. pascale ||| fondazione irccs istituto nazionale dei tumori ||| istituto nazionale per lo studio e la cura dei tumori - fondazione g. pascale","skipped","Fondazione Irccs Istituto Nazionale Dei Tumori","Istituto Nazionale Per Lo Studio E La Cura Dei Tumori - Fondazione G. Pascale","Fondazione Irccs Istituto Nazionale Dei Tumori","Istituto Nazionale Per Lo Studio E La Cura Dei Tumori - Fondazione G. Pascale",123,0.296,"2026-05-05 20:26:51 +0200","Skipped interactively"
"universitaetsklinikum erlangen ||| universitaetsklinikum tuebingen aör ||| universitaetsklinikum erlangen ||| universitaetsklinikum tuebingen aör","skipped","Universitaetsklinikum Erlangen","Universitaetsklinikum Tuebingen Aör","Universitaetsklinikum Erlangen","Universitaetsklinikum Tuebingen Aör",96,0.765,"2026-05-05 20:26:52 +0200","Skipped interactively"
"istituto nazionale per lo studio e la cura dei tumori - fondazione g. pascale ||| istituto nazionale per la cura tumori ||| istituto nazionale per lo studio e la cura dei tumori - fondazione g. pascale ||| istituto nazionale per la cura tumori","skipped","Istituto Nazionale Per Lo Studio E La Cura Dei Tumori - Fondazione G. Pascale","Istituto Nazionale Per La Cura Tumori","Istituto Nazionale Per Lo Studio E La Cura Dei Tumori - Fondazione G. Pascale","Istituto Nazionale Per La Cura Tumori",95,0.479,"2026-05-05 20:26:55 +0200","Skipped interactively"
"universitaetsklinikum erlangen ||| universitaetsklinikum essen aör ||| universitaetsklinikum erlangen ||| universitaetsklinikum essen aör","skipped","Universitaetsklinikum Erlangen","Universitaetsklinikum Essen Aör","Universitaetsklinikum Erlangen","Universitaetsklinikum Essen Aör",81,0.8,"2026-05-05 20:26:56 +0200","Skipped interactively"
"universitaetsklinikum erlangen ||| universitaetsklinikum ulm aör ||| universitaetsklinikum erlangen ||| universitaetsklinikum ulm aör","skipped","Universitaetsklinikum Erlangen","Universitaetsklinikum Ulm Aör","Universitaetsklinikum Erlangen","Universitaetsklinikum Ulm Aör",77,0.767,"2026-05-05 20:26:57 +0200","Skipped interactively"
"istituto nazionale per lo studio e la cura dei tumori - fondazione g. pascale ||| istituto scientifico romagnolo per lo studio e la cura dei tumori ||| istituto nazionale per lo studio e la cura dei tumori - fondazione g. pascale ||| istituto scientifico romagnolo per lo studio e la cura dei tumori","skipped","Istituto Nazionale Per Lo Studio E La Cura Dei Tumori - Fondazione G. Pascale","Istituto Scientifico Romagnolo Per Lo Studio E La Cura Dei Tumori","Istituto Nazionale Per Lo Studio E La Cura Dei Tumori - Fondazione G. Pascale","Istituto Scientifico Romagnolo Per Lo Studio E La Cura Dei Tumori",67,0.479,"2026-05-05 20:27:02 +0200","Skipped interactively"
"helsinki university central hospital ||| central manchester university hospitals nhs foundation trust ||| helsinki university central hospital ||| central manchester university hospitals nhs foundation trust","skipped","Helsinki University Central Hospital","Central Manchester University Hospitals Nhs Foundation Trust","Helsinki University Central Hospital","Central Manchester University Hospitals Nhs Foundation Trust",66,0.395,"2026-05-05 20:27:03 +0200","Skipped interactively"
"university of nottingham ||| nottingham university hospitals nhs trust ||| university of nottingham ||| nottingham university hospitals nhs trust","skipped","University Of Nottingham","Nottingham University Hospitals Nhs Trust","University Of Nottingham","Nottingham University Hospitals Nhs Trust",65,0.4,"2026-05-05 20:27:05 +0200","Skipped interactively"
"istituto nazionale per la cura tumori ||| istituto scientifico romagnolo per lo studio e la cura dei tumori ||| istituto nazionale per la cura tumori ||| istituto scientifico romagnolo per lo studio e la cura dei tumori","skipped","Istituto Nazionale Per La Cura Tumori","Istituto Scientifico Romagnolo Per Lo Studio E La Cura Dei Tumori","Istituto Nazionale Per La Cura Tumori","Istituto Scientifico Romagnolo Per Lo Studio E La Cura Dei Tumori",60,0.484,"2026-05-05 20:27:08 +0200","Skipped interactively"
"istituto nazionale per la cura tumori ||| istituto scientifico romagnolo per lo studio e la cura dei tumori irst . irccs ||| istituto nazionale per la cura tumori ||| istituto scientifico romagnolo per lo studio e la cura dei tumori irst . irccs","skipped","Istituto Nazionale Per La Cura Tumori","Istituto Scientifico Romagnolo Per Lo Studio E La Cura Dei Tumori Irst . Irccs","Istituto Nazionale Per La Cura Tumori","Istituto Scientifico Romagnolo Per Lo Studio E La Cura Dei Tumori Irst . Irccs",59,0.411,"2026-05-05 20:27:09 +0200","Skipped interactively"
"turku university hospital ||| university of turku ||| turku university hospital ||| university of turku","skipped","Turku University Hospital","University Of Turku","Turku University Hospital","University Of Turku",58,0.44,"2026-05-05 20:27:11 +0200","Skipped interactively"
"helsinki university central hospital ||| university of helsinki ||| helsinki university central hospital ||| university of helsinki","skipped","Helsinki University Central Hospital","University Of Helsinki","Helsinki University Central Hospital","University Of Helsinki",58,0.417,"2026-05-05 20:27:13 +0200","Skipped interactively"
"chu saint-etienne ||| chu saint pierre ||| chu saint-etienne ||| chu saint pierre","skipped","CHU Saint-Etienne","Chu Saint Pierre","CHU Saint-Etienne","Chu Saint Pierre",56,0.765,"2026-05-05 20:27:14 +0200","Skipped interactively"
"university hospital southampton nhs foundation trust ||| university of southampton ||| university hospital southampton nhs foundation trust ||| university of southampton","skipped","University Hospital Southampton NHS Foundation Trust","University Of Southampton","University Hospital Southampton NHS Foundation Trust","University Of Southampton",56,0.71,"2026-05-05 20:27:16 +0200","Skipped interactively"
"azienda ospedaliera policlinico di modena ||| azienda ospedaliera ospedale policlinico consorziale ||| azienda ospedaliera policlinico di modena ||| azienda ospedaliera ospedale policlinico consorziale","skipped","Azienda Ospedaliera Policlinico Di Modena","Azienda Ospedaliera Ospedale Policlinico Consorziale","Azienda Ospedaliera Policlinico Di Modena","Azienda Ospedaliera Ospedale Policlinico Consorziale",56,0.654,"2026-05-05 20:27:17 +0200","Skipped interactively"
"university hospitals bristol nhs foundation trust ||| university of bristol ||| university hospitals bristol nhs foundation trust ||| university of bristol","skipped","University Hospitals Bristol NHS Foundation Trust","University Of Bristol","University Hospitals Bristol NHS Foundation Trust","University Of Bristol",53,0.667,"2026-05-05 20:27:19 +0200","Skipped interactively"
"beone medicines ||| the medicines company ||| beone medicines ||| the medicines company","skipped","Beone Medicines","The Medicines Company","Beone Medicines","The Medicines Company",48,0.6,"2026-05-05 20:27:20 +0200","Skipped interactively"
"fondazione italiana linfomi onlus ||| fondazione italiana linfomi ets ||| fondazione italiana linfomi onlus ||| fondazione italiana linfomi ets","skipped","Fondazione Italiana Linfomi Onlus","Fondazione Italiana Linfomi Ets","Fondazione Italiana Linfomi Onlus","Fondazione Italiana Linfomi Ets",46,0.879,"2026-05-05 20:27:28 +0200","Skipped interactively"
"azienda ospedaliera ospedali riuniti di bergamo a.o. di rilievo nazionale ||| azienda ospedaliera l. sacco a.o. di rilievo nazionale ||| azienda ospedaliera ospedali riuniti di bergamo a.o. di rilievo nazionale ||| azienda ospedaliera l. sacco a.o. di rilievo nazionale","skipped","AZIENDA OSPEDALIERA OSPEDALI RIUNITI DI BERGAMO A.O. DI RILIEVO NAZIONALE","AZIENDA OSPEDALIERA L. SACCO A.O. DI RILIEVO NAZIONALE","AZIENDA OSPEDALIERA OSPEDALI RIUNITI DI BERGAMO A.O. DI RILIEVO NAZIONALE","AZIENDA OSPEDALIERA L. SACCO A.O. DI RILIEVO NAZIONALE",46,0.672,"2026-05-05 20:27:29 +0200","Skipped interactively"
"bispebjerg hospital ||| bispebjerg university hospital ||| bispebjerg hospital ||| bispebjerg university hospital","approved","Bispebjerg Hospital","Bispebjerg University Hospital","Bispebjerg Hospital","Bispebjerg University Hospital",45,0.633,"2026-05-05 20:27:34 +0200",""
"centre hospitalier regional universitaire de tours ||| centre hospitalier regional et universitaire de brest ||| centre hospitalier regional universitaire de tours ||| centre hospitalier regional et universitaire de brest","skipped","Centre Hospitalier Regional Universitaire De Tours","Centre Hospitalier Regional Et Universitaire De Brest","Centre Hospitalier Regional Universitaire De Tours","Centre Hospitalier Regional Et Universitaire De Brest",44,0.83,"2026-05-05 20:27:35 +0200","Skipped interactively"
"laboratoires thea ||| laboratoires smb ||| laboratoires thea ||| laboratoires smb","skipped","Laboratoires Thea","Laboratoires Smb","Laboratoires Thea","Laboratoires Smb",44,0.765,"2026-05-05 20:27:40 +0200","Skipped interactively"
"inserm ||| inserm-anrs ||| inserm ||| inserm-anrs","approved","Inserm","Inserm-Anrs","Inserm","Inserm-Anrs",44,0.545,"2026-05-05 20:27:42 +0200",""
"antwerp university hospital ||| university of antwerp ||| antwerp university hospital ||| university of antwerp","approved","Antwerp University Hospital","University Of Antwerp","Antwerp University Hospital","University Of Antwerp",44,0.407,"2026-05-05 20:27:46 +0200",""
"laboratorios leti ||| laboratorios alter ||| laboratorios leti ||| laboratorios alter","skipped","Laboratorios Leti","Laboratorios Alter","Laboratorios Leti","Laboratorios Alter",43,0.778,"2026-05-05 20:27:48 +0200","Skipped interactively"
"centre hospitalier regional universitaire de tours ||| centre hospitalier regional de marseille ||| centre hospitalier regional universitaire de tours ||| centre hospitalier regional de marseille","skipped","Centre Hospitalier Regional Universitaire De Tours","Centre Hospitalier Regional De Marseille","Centre Hospitalier Regional Universitaire De Tours","Centre Hospitalier Regional De Marseille",43,0.682,"2026-05-05 20:27:52 +0200","Skipped interactively"
"tibotec ||| tibotec bvba ||| tibotec ||| tibotec bvba","approved","Tibotec","Tibotec Bvba","Tibotec","Tibotec Bvba",43,0.583,"2026-05-05 20:27:53 +0200",""
"azienda ospedaliera ospedali riuniti di bergamo a.o. di rilievo nazionale ||| azienda ospedaliera ospedale niguarda ca granda a.o. di rilievo nazionale ||| azienda ospedaliera ospedali riuniti di bergamo a.o. di rilievo nazionale ||| azienda ospedaliera ospedale niguarda ca granda a.o. di rilievo nazionale","skipped","AZIENDA OSPEDALIERA OSPEDALI RIUNITI DI BERGAMO A.O. DI RILIEVO NAZIONALE","AZIENDA OSPEDALIERA OSPEDALE NIGUARDA CA GRANDA A.O. DI RILIEVO NAZIONALE","AZIENDA OSPEDALIERA OSPEDALI RIUNITI DI BERGAMO A.O. DI RILIEVO NAZIONALE","AZIENDA OSPEDALIERA OSPEDALE NIGUARDA CA GRANDA A.O. DI RILIEVO NAZIONALE",42,0.791,"2026-05-05 20:27:57 +0200","Skipped interactively"
"centre hospitalier regional universitaire de tours ||| centre hospitalier regional universitaire ||| centre hospitalier regional universitaire de tours ||| centre hospitalier regional universitaire","skipped","Centre Hospitalier Regional Universitaire De Tours","Centre Hospitalier Regional Universitaire","Centre Hospitalier Regional Universitaire De Tours","Centre Hospitalier Regional Universitaire",41,0.864,"2026-05-05 20:28:02 +0200","Skipped interactively"
"hpitaux universitaires de strasbourg ||| les hopitaux universitaires de strasbourg ||| hpitaux universitaires de strasbourg ||| les hopitaux universitaires de strasbourg","approved","Hpitaux Universitaires De Strasbourg","Les Hopitaux Universitaires De Strasbourg","Hpitaux Universitaires De Strasbourg","Les Hopitaux Universitaires De Strasbourg",41,0.789,"2026-05-05 20:28:05 +0200",""
"azienda ospedaliera spedali civili di brescia ||| azienda socio sanitaria territoriale degli spedali civili di brescia ||| azienda ospedaliera spedali civili di brescia ||| azienda socio sanitaria territoriale degli spedali civili di brescia","skipped","Azienda Ospedaliera Spedali Civili Di Brescia","Azienda Socio Sanitaria Territoriale Degli Spedali Civili Di Brescia","Azienda Ospedaliera Spedali Civili Di Brescia","Azienda Socio Sanitaria Territoriale Degli Spedali Civili Di Brescia",41,0.585,"2026-05-05 20:28:12 +0200","Skipped interactively"
"bispebjerg hospital ||| department of dermatology d92, bispebjerg hospital ||| bispebjerg hospital ||| department of dermatology d92, bispebjerg hospital","approved","Bispebjerg Hospital","Department Of Dermatology D92, Bispebjerg Hospital","Bispebjerg Hospital","Department Of Dermatology D92, Bispebjerg Hospital",41,0.413,"2026-05-05 20:28:15 +0200",""
"zealand ||| zealand university hospital ||| zealand ||| zealand university hospital","approved","Zealand","Zealand University Hospital","Zealand","Zealand University Hospital",40,0.259,"2026-05-05 20:28:44 +0200",""
"azienda universitaria policlinico umberto i di roma ||| umberto i ||| azienda universitaria policlinico umberto i di roma ||| umberto i","approved","Azienda Universitaria Policlinico Umberto I Di Roma","Umberto I","Azienda Universitaria Policlinico Umberto I Di Roma","Umberto I",40,0.188,"2026-05-05 20:28:50 +0200",""
"fundaci lluita contra la sida ||| fundaci de lluita contra la sida ||| fundaci lluita contra la sida ||| fundaci de lluita contra la sida","approved","Fundaci Lluita Contra La Sida","Fundaci De Lluita Contra La Sida","Fundaci Lluita Contra La Sida","Fundaci De Lluita Contra La Sida",38,1,"2026-05-05 20:28:53 +0200",""
"azienda ospedaliera universitaria integrata verona ||| azienda ospedaliera universitaria careggi ||| azienda ospedaliera universitaria integrata verona ||| azienda ospedaliera universitaria careggi","skipped","Azienda Ospedaliera Universitaria Integrata Verona","Azienda Ospedaliera Universitaria Careggi","Azienda Ospedaliera Universitaria Integrata Verona","Azienda Ospedaliera Universitaria Careggi",38,0.72,"2026-05-05 20:28:56 +0200","Skipped interactively"
"centre hospitalier regional universitaire de tours ||| centre hospitalier universitaire de liege ||| centre hospitalier regional universitaire de tours ||| centre hospitalier universitaire de liege","skipped","Centre Hospitalier Regional Universitaire De Tours","Centre Hospitalier Universitaire De Liege","Centre Hospitalier Regional Universitaire De Tours","Centre Hospitalier Universitaire De Liege",38,0.682,"2026-05-05 20:28:59 +0200","Skipped interactively"
"hull and east yorkshire hospitals nhs trust ||| hull and east yorkshire nhs trust ||| hull and east yorkshire hospitals nhs trust ||| hull and east yorkshire nhs trust","skipped","Hull And East Yorkshire Hospitals NHS Trust","Hull And East Yorkshire Nhs Trust","Hull And East Yorkshire Hospitals NHS Trust","Hull And East Yorkshire Nhs Trust",38,0.679,"2026-05-05 20:29:00 +0200","Skipped interactively"
"azienda ospedaliera l. sacco a.o. di rilievo nazionale ||| azienda ospedaliera ospedale niguarda ca granda a.o. di rilievo nazionale ||| azienda ospedaliera l. sacco a.o. di rilievo nazionale ||| azienda ospedaliera ospedale niguarda ca granda a.o. di rilievo nazionale","skipped","AZIENDA OSPEDALIERA L. SACCO A.O. DI RILIEVO NAZIONALE","AZIENDA OSPEDALIERA OSPEDALE NIGUARDA CA GRANDA A.O. DI RILIEVO NAZIONALE","AZIENDA OSPEDALIERA L. SACCO A.O. DI RILIEVO NAZIONALE","AZIENDA OSPEDALIERA OSPEDALE NIGUARDA CA GRANDA A.O. DI RILIEVO NAZIONALE",38,0.657,"2026-05-05 20:29:02 +0200","Skipped interactively"
"steno diabetes center copenhagen ||| steno diabetes center ||| steno diabetes center copenhagen ||| steno diabetes center","approved","Steno Diabetes Center Copenhagen","Steno Diabetes Center","Steno Diabetes Center Copenhagen","Steno Diabetes Center",38,0.656,"2026-05-05 20:29:07 +0200",""
"azienda ospedaliera universitaria integrata verona ||| verona ||| azienda ospedaliera universitaria integrata verona ||| verona","approved","Azienda Ospedaliera Universitaria Integrata Verona","Verona","Azienda Ospedaliera Universitaria Integrata Verona","Verona",38,0.12,"2026-05-05 20:29:12 +0200",""
"consorci mar parc de salut de barcelona parc de salut mar ||| consorci mar parc de salut de barcelona ||| consorci mar parc de salut de barcelona parc de salut mar ||| consorci mar parc de salut de barcelona","approved","Consorci Mar Parc De Salut De Barcelona Parc De Salut Mar","Consorci Mar Parc De Salut De Barcelona","Consorci Mar Parc De Salut De Barcelona Parc De Salut Mar","Consorci Mar Parc De Salut De Barcelona",37,0.688,"2026-05-05 20:29:18 +0200",""
"uppsala university ||| uppsala university hospital ||| uppsala university ||| uppsala university hospital","skipped","Uppsala University","Uppsala University Hospital","Uppsala University","Uppsala University Hospital",37,0.667,"2026-05-05 20:29:21 +0200","Skipped interactively"
"centre hospitalier universitaire amiens picardie ||| centre hospitalier regional universitaire ||| centre hospitalier universitaire amiens picardie ||| centre hospitalier regional universitaire","skipped","Centre Hospitalier Universitaire Amiens Picardie","Centre Hospitalier Regional Universitaire","Centre Hospitalier Universitaire Amiens Picardie","Centre Hospitalier Regional Universitaire",37,0.556,"2026-05-05 20:29:24 +0200","Skipped interactively"
"university of liverpool ||| the university of liverpool ||| university of liverpool ||| the university of liverpool","approved","University Of Liverpool","The University Of Liverpool","University Of Liverpool","The University Of Liverpool",36,1,"2026-05-05 20:29:27 +0200",""
"azienda ospedaliera universitaria integrata verona ||| a.o. universitaria integrata di verona ||| azienda ospedaliera universitaria integrata verona ||| a.o. universitaria integrata di verona","approved","Azienda Ospedaliera Universitaria Integrata Verona","A.O. UNIVERSITARIA INTEGRATA DI VERONA","Azienda Ospedaliera Universitaria Integrata Verona","A.O. UNIVERSITARIA INTEGRATA DI VERONA",47,0.64,"2026-05-05 20:33:21 +0200",""
"azienda ospedaliera universitaria integrata verona ||| azienda ospedaliera universitaria senese ||| azienda ospedaliera universitaria integrata verona ||| azienda ospedaliera universitaria senese","skipped","Azienda Ospedaliera Universitaria Integrata Verona","Azienda Ospedaliera Universitaria Senese","Azienda Ospedaliera Universitaria Integrata Verona","Azienda Ospedaliera Universitaria Senese",44,0.72,"2026-05-05 20:33:24 +0200","Skipped interactively"
"azienda ospedaliera universitaria integrata verona ||| azienda ospedaliera universitaria san martino genova ||| azienda ospedaliera universitaria integrata verona ||| azienda ospedaliera universitaria san martino genova","skipped","Azienda Ospedaliera Universitaria Integrata Verona","Azienda Ospedaliera Universitaria San Martino Genova","Azienda Ospedaliera Universitaria Integrata Verona","Azienda Ospedaliera Universitaria San Martino Genova",43,0.769,"2026-05-05 20:33:26 +0200","Skipped interactively"
"university of liverpool ||| royal liverpool university hospital ||| university of liverpool ||| royal liverpool university hospital","skipped","University Of Liverpool","Royal Liverpool University Hospital","University Of Liverpool","Royal Liverpool University Hospital",42,0.314,"2026-05-05 20:33:31 +0200","Skipped interactively"
"university of leipzig ||| universitt leipzig ||| university of leipzig ||| universitt leipzig","approved","University Of Leipzig","Universitt Leipzig","University Of Leipzig","Universitt Leipzig",36,0.944,"2026-05-05 20:33:33 +0200",""
"istituti fisioterapici ospitalieri ||| i.f.o. istituti fisioterapici ospitalieri ||| istituti fisioterapici ospitalieri ||| i.f.o. istituti fisioterapici ospitalieri","approved","Istituti Fisioterapici Ospitalieri","I.F.O. Istituti Fisioterapici Ospitalieri","Istituti Fisioterapici Ospitalieri","I.F.O. Istituti Fisioterapici Ospitalieri",36,0.85,"2026-05-05 20:33:38 +0200",""
"centre hospitalier regional universitaire de tours ||| centre hospitalier universitaire de poitiers ||| centre hospitalier regional universitaire de tours ||| centre hospitalier universitaire de poitiers","skipped","Centre Hospitalier Regional Universitaire De Tours","Centre Hospitalier Universitaire De Poitiers","Centre Hospitalier Regional Universitaire De Tours","Centre Hospitalier Universitaire De Poitiers",36,0.682,"2026-05-05 20:33:41 +0200","Skipped interactively"
"altana ||| bracco altana ||| altana ||| bracco altana","approved","Altana","Bracco Altana","Altana","Bracco Altana",36,0.462,"2026-05-05 20:33:45 +0200",""
"orion ||| orion orion ||| orion ||| orion orion","approved","Orion","Orion Orion","Orion","Orion Orion",36,0.455,"2026-05-05 20:33:46 +0200",""
"instituto grifols ||| grifols ||| instituto grifols ||| grifols","approved","Instituto Grifols","Grifols","Instituto Grifols","Grifols",36,0.412,"2026-05-05 20:33:48 +0200",""
"universitaetsklinikum tuebingen aör ||| universitaetsklinikum essen aör ||| universitaetsklinikum tuebingen aör ||| universitaetsklinikum essen aör","skipped","Universitaetsklinikum Tuebingen Aör","Universitaetsklinikum Essen Aör","Universitaetsklinikum Tuebingen Aör","Universitaetsklinikum Essen Aör",35,0.824,"2026-05-05 20:33:49 +0200","Skipped interactively"
"universita campus biomedico ||| universit campus bio-medico di roma ||| universita campus biomedico ||| universit campus bio-medico di roma","skipped","Universita Campus Biomedico","Universit Campus Bio-Medico Di Roma","Universita Campus Biomedico","Universit Campus Bio-Medico Di Roma",35,0.781,"2026-05-05 20:33:52 +0200","Skipped interactively"
"fondazione irccs ca granda ospedale maggiore policlinico ||| fondazione irccs ca granda ospedale maggiore policlinico di milano ||| fondazione irccs ca granda ospedale maggiore policlinico ||| fondazione irccs ca granda ospedale maggiore policlinico di milano","approved","Fondazione Irccs Ca Granda Ospedale Maggiore Policlinico","Fondazione Irccs Ca Granda Ospedale Maggiore Policlinico Di Milano","Fondazione Irccs Ca Granda Ospedale Maggiore Policlinico","Fondazione Irccs Ca Granda Ospedale Maggiore Policlinico Di Milano",34,0.889,"2026-05-05 20:34:01 +0200",""
"universitaetsklinikum heidelberg aör ||| universittsklinikum heidelberg ||| universitaetsklinikum heidelberg aör ||| universittsklinikum heidelberg","approved","Universitaetsklinikum Heidelberg Aör","Universittsklinikum Heidelberg","Universitaetsklinikum Heidelberg Aör","Universittsklinikum Heidelberg",34,0.857,"2026-05-05 20:34:03 +0200",""
"centre hospitalier universitaire amiens picardie ||| centre hospitalier universitaire de liege ||| centre hospitalier universitaire amiens picardie ||| centre hospitalier universitaire de liege","skipped","Centre Hospitalier Universitaire Amiens Picardie","Centre Hospitalier Universitaire De Liege","Centre Hospitalier Universitaire Amiens Picardie","Centre Hospitalier Universitaire De Liege",34,0.733,"2026-05-05 20:34:05 +0200","Skipped interactively"
"centre hospitalier regional universitaire de tours ||| centre hospitalier universitaire de reims ||| centre hospitalier regional universitaire de tours ||| centre hospitalier universitaire de reims","skipped","Centre Hospitalier Regional Universitaire De Tours","Centre Hospitalier Universitaire De Reims","Centre Hospitalier Regional Universitaire De Tours","Centre Hospitalier Universitaire De Reims",34,0.705,"2026-05-05 20:34:06 +0200","Skipped interactively"
"centre hospitalier regional universitaire de tours ||| centre hospitalier universitaire de nancy ||| centre hospitalier regional universitaire de tours ||| centre hospitalier universitaire de nancy","skipped","Centre Hospitalier Regional Universitaire De Tours","Centre Hospitalier Universitaire De Nancy","Centre Hospitalier Regional Universitaire De Tours","Centre Hospitalier Universitaire De Nancy",34,0.682,"2026-05-05 20:34:07 +0200","Skipped interactively"
