"decision_key","decision","canonical_suggestion","suggested_pattern","sponsor_a","sponsor_b","total_n","similarity_score","decided_at","notes"
"centre hospitalier regional universitaire de tours ||| centre hospitalier universitaire brugmann ||| centre hospitalier regional universitaire de tours ||| centre hospitalier universitaire brugmann","skipped","Centre Hospitalier Regional Universitaire De Tours","Centre Hospitalier Universitaire Brugmann","Centre Hospitalier Regional Universitaire De Tours","Centre Hospitalier Universitaire Brugmann",34,0.636,"2026-05-05 20:34:08 +0200","Skipped interactively"
"centre hospitalier regional universitaire de tours ||| centre hospitalier universitaire de besanon ||| centre hospitalier regional universitaire de tours ||| centre hospitalier universitaire de besanon","skipped","Centre Hospitalier Regional Universitaire De Tours","Centre Hospitalier Universitaire De Besanon","Centre Hospitalier Regional Universitaire De Tours","Centre Hospitalier Universitaire De Besanon",34,0.636,"2026-05-05 20:34:08 +0200","Skipped interactively"
"cancer ||| the institute of cancer ||| cancer ||| the institute of cancer","approved","Cancer","The Institute Of Cancer","Cancer","The Institute Of Cancer",34,0.375,"2026-05-05 20:34:30 +0200",""
"centre hospitalier universitaire amiens picardie ||| centre hospitalier universitaire de caen normandie ||| centre hospitalier universitaire amiens picardie ||| centre hospitalier universitaire de caen normandie","skipped","Centre Hospitalier Universitaire Amiens Picardie","Centre Hospitalier Universitaire De Caen Normandie","Centre Hospitalier Universitaire Amiens Picardie","Centre Hospitalier Universitaire De Caen Normandie",32,0.8,"2026-05-05 20:34:32 +0200","Skipped interactively"
"universitaetsklinikum heidelberg aör ||| universitaetsklinikum essen aör ||| universitaetsklinikum heidelberg aör ||| universitaetsklinikum essen aör","skipped","Universitaetsklinikum Heidelberg Aör","Universitaetsklinikum Essen Aör","Universitaetsklinikum Heidelberg Aör","Universitaetsklinikum Essen Aör",32,0.771,"2026-05-05 20:34:34 +0200","Skipped interactively"
"centre hospitalier universitaire amiens picardie ||| centre hospitalier universitaire de poitiers ||| centre hospitalier universitaire amiens picardie ||| centre hospitalier universitaire de poitiers","skipped","Centre Hospitalier Universitaire Amiens Picardie","Centre Hospitalier Universitaire De Poitiers","Centre Hospitalier Universitaire Amiens Picardie","Centre Hospitalier Universitaire De Poitiers",32,0.733,"2026-05-05 20:34:35 +0200","Skipped interactively"
"istituto neurologico carlo besta ||| fondazione irccs istituto neurologico carlo besta ||| istituto neurologico carlo besta ||| fondazione irccs istituto neurologico carlo besta","approved","Istituto Neurologico Carlo Besta","Fondazione Irccs Istituto Neurologico Carlo Besta","Istituto Neurologico Carlo Besta","Fondazione Irccs Istituto Neurologico Carlo Besta",32,0.653,"2026-05-05 20:34:38 +0200",""
"the medicines company ||| blueprint medicines ||| the medicines company ||| blueprint medicines","skipped","The Medicines Company","Blueprint Medicines","The Medicines Company","Blueprint Medicines",32,0.474,"2026-05-05 20:34:41 +0200","Skipped interactively"
"cancer ||| cancer trials ||| cancer ||| cancer trials","skipped","Cancer","Cancer Trials","Cancer","Cancer Trials",32,0.462,"2026-05-05 20:34:44 +0200","Skipped interactively"
"istituto scientifico romagnolo per lo studio e la cura dei tumori ||| istituto scientifico romagnolo per lo studio e la cura dei tumori irst . irccs ||| istituto scientifico romagnolo per lo studio e la cura dei tumori ||| istituto scientifico romagnolo per lo studio e la cura dei tumori irst . irccs","approved","Istituto Scientifico Romagnolo Per Lo Studio E La Cura Dei Tumori","Istituto Scientifico Romagnolo Per Lo Studio E La Cura Dei Tumori Irst . Irccs","Istituto Scientifico Romagnolo Per Lo Studio E La Cura Dei Tumori","Istituto Scientifico Romagnolo Per Lo Studio E La Cura Dei Tumori Irst . Irccs",31,0.849,"2026-05-05 20:34:49 +0200",""
"universittsklinikum mnster ||| universittsklinikum ulm ||| universittsklinikum mnster ||| universittsklinikum ulm","skipped","Universittsklinikum Mnster","Universittsklinikum Ulm","Universittsklinikum Mnster","Universittsklinikum Ulm",31,0.769,"2026-05-05 20:34:50 +0200","Skipped interactively"
"universitaetsklinikum tuebingen aör ||| universitaetsklinikum ulm aör ||| universitaetsklinikum tuebingen aör ||| universitaetsklinikum ulm aör","skipped","Universitaetsklinikum Tuebingen Aör","Universitaetsklinikum Ulm Aör","Universitaetsklinikum Tuebingen Aör","Universitaetsklinikum Ulm Aör",31,0.765,"2026-05-05 20:34:52 +0200","Skipped interactively"
"centre hospitalier regional et universitaire de brest ||| centre hospitalier regional de marseille ||| centre hospitalier regional et universitaire de brest ||| centre hospitalier regional de marseille","skipped","Centre Hospitalier Regional Et Universitaire De Brest","Centre Hospitalier Regional De Marseille","Centre Hospitalier Regional Et Universitaire De Brest","Centre Hospitalier Regional De Marseille",31,0.66,"2026-05-05 20:34:54 +0200","Skipped interactively"
"azienda ospedaliera ospedali riuniti di bergamo a.o. di rilievo nazionale ||| azienda ospedaliera ospedali galliera ||| azienda ospedaliera ospedali riuniti di bergamo a.o. di rilievo nazionale ||| azienda ospedaliera ospedali galliera","skipped","AZIENDA OSPEDALIERA OSPEDALI RIUNITI DI BERGAMO A.O. DI RILIEVO NAZIONALE","Azienda Ospedaliera Ospedali Galliera","AZIENDA OSPEDALIERA OSPEDALI RIUNITI DI BERGAMO A.O. DI RILIEVO NAZIONALE","Azienda Ospedaliera Ospedali Galliera",31,0.547,"2026-05-05 20:34:56 +0200","Skipped interactively"
"fondazione irccs ca granda ospedale maggiore policlinico ||| ospedale maggiore di milano irccs ||| fondazione irccs ca granda ospedale maggiore policlinico ||| ospedale maggiore di milano irccs","skipped","Fondazione Irccs Ca Granda Ospedale Maggiore Policlinico","Ospedale Maggiore Di Milano Irccs","Fondazione Irccs Ca Granda Ospedale Maggiore Policlinico","Ospedale Maggiore Di Milano Irccs",31,0.357,"2026-05-05 20:34:59 +0200","Skipped interactively"
"chru de nancy ||| chru nancy ||| chru de nancy ||| chru nancy","approved","Chru De Nancy","Chru Nancy","Chru De Nancy","Chru Nancy",30,1,"2026-05-05 20:35:02 +0200",""
"technische universitt dresden ||| technical university dresden ||| technische universitt dresden ||| technical university dresden","approved","Technische Universitt Dresden","Technical University Dresden","Technische Universitt Dresden","Technical University Dresden",30,0.862,"2026-05-05 20:35:04 +0200",""
"klinikum der universitt mnchen ||| klinikum der universitaet muenchen aör ||| klinikum der universitt mnchen ||| klinikum der universitaet muenchen aör","approved","Klinikum Der Universitt Mnchen","Klinikum Der Universitaet Muenchen Aör","Klinikum Der Universitt Mnchen","Klinikum Der Universitaet Muenchen Aör",30,0.788,"2026-05-05 20:35:07 +0200",""
"frankfurter institut fuer klinische krebsforschung ikf ||| institut fuer klinische krebsforschung ikf ||| frankfurter institut fuer klinische krebsforschung ikf ||| institut fuer klinische krebsforschung ikf","skipped","Frankfurter Institut Fuer Klinische Krebsforschung Ikf","Institut Fuer Klinische Krebsforschung Ikf","Frankfurter Institut Fuer Klinische Krebsforschung Ikf","Institut Fuer Klinische Krebsforschung Ikf",30,0.778,"2026-05-05 20:35:13 +0200","Skipped interactively"
"centre hospitalier universitaire amiens picardie ||| centre hospitalier universitaire de besanon ||| centre hospitalier universitaire amiens picardie ||| centre hospitalier universitaire de besanon","skipped","Centre Hospitalier Universitaire Amiens Picardie","Centre Hospitalier Universitaire De Besanon","Centre Hospitalier Universitaire Amiens Picardie","Centre Hospitalier Universitaire De Besanon",30,0.733,"2026-05-05 20:35:15 +0200","Skipped interactively"
"centre hospitalier universitaire amiens picardie ||| centre hospitalier universitaire de nancy ||| centre hospitalier universitaire amiens picardie ||| centre hospitalier universitaire de nancy","skipped","Centre Hospitalier Universitaire Amiens Picardie","Centre Hospitalier Universitaire De Nancy","Centre Hospitalier Universitaire Amiens Picardie","Centre Hospitalier Universitaire De Nancy",30,0.711,"2026-05-05 20:35:16 +0200","Skipped interactively"
"centre hospitalier universitaire amiens picardie ||| centre hospitalier universitaire de reims ||| centre hospitalier universitaire amiens picardie ||| centre hospitalier universitaire de reims","skipped","Centre Hospitalier Universitaire Amiens Picardie","Centre Hospitalier Universitaire De Reims","Centre Hospitalier Universitaire Amiens Picardie","Centre Hospitalier Universitaire De Reims",30,0.711,"2026-05-05 20:35:17 +0200","Skipped interactively"
"centre hospitalier universitaire amiens picardie ||| centre hospitalier universitaire brugmann ||| centre hospitalier universitaire amiens picardie ||| centre hospitalier universitaire brugmann","skipped","Centre Hospitalier Universitaire Amiens Picardie","Centre Hospitalier Universitaire Brugmann","Centre Hospitalier Universitaire Amiens Picardie","Centre Hospitalier Universitaire Brugmann",30,0.689,"2026-05-05 20:35:18 +0200","Skipped interactively"
"fresenius kabi ||| fresenius ||| fresenius kabi ||| fresenius","approved","Fresenius Kabi","Fresenius","Fresenius Kabi","Fresenius",30,0.643,"2026-05-05 20:35:20 +0200",""
"the medicines company ||| revolution medicines ||| the medicines company ||| revolution medicines","skipped","The Medicines Company","Revolution Medicines","The Medicines Company","Revolution Medicines",30,0.45,"2026-05-05 20:35:21 +0200","Skipped interactively"
"technische universitt dresden ||| technische universitat dresden ||| technische universitt dresden ||| technische universitat dresden","approved","Technische Universitt Dresden","Technische Universitat Dresden","Technische Universitt Dresden","Technische Universitat Dresden",29,0.966,"2026-05-05 20:35:23 +0200",""
"universittsklinikum mnster ||| universittsklinikum essen ||| universittsklinikum mnster ||| universittsklinikum essen","skipped","Universittsklinikum Mnster","Universittsklinikum Essen","Universittsklinikum Mnster","Universittsklinikum Essen",29,0.846,"2026-05-05 20:35:24 +0200","Skipped interactively"
"centre hospitalier regional et universitaire de brest ||| centre hospitalier regional universitaire ||| centre hospitalier regional et universitaire de brest ||| centre hospitalier regional universitaire","skipped","Centre Hospitalier Regional Et Universitaire De Brest","Centre Hospitalier Regional Universitaire","Centre Hospitalier Regional Et Universitaire De Brest","Centre Hospitalier Regional Universitaire",29,0.809,"2026-05-05 20:35:26 +0200","Skipped interactively"
"aalborg university hospital ||| mech-sense, aalborg university hospital ||| aalborg university hospital ||| mech-sense, aalborg university hospital","approved","Aalborg University Hospital","Mech-Sense, Aalborg University Hospital","Aalborg University Hospital","Mech-Sense, Aalborg University Hospital",29,0.711,"2026-05-05 20:35:30 +0200",""
"azienda ospedaliera senese ||| azienda ospedaliera universitaria senese ||| azienda ospedaliera senese ||| azienda ospedaliera universitaria senese","approved","Azienda Ospedaliera Senese","Azienda Ospedaliera Universitaria Senese","Azienda Ospedaliera Senese","Azienda Ospedaliera Universitaria Senese",29,0.65,"2026-05-05 20:35:32 +0200",""
"azienda ospedaliero universitaria ospedali riuniti umberto i - g.m.lancisi - g.salesi ||| azienda ospedaliero universitaria di modena ||| azienda ospedaliero universitaria ospedali riuniti umberto i - g.m.lancisi - g.salesi ||| azienda ospedaliero universitaria di modena","skipped","AZIENDA OSPEDALIERO UNIVERSITARIA OSPEDALI RIUNITI UMBERTO I - G.M.LANCISI - G.SALESI","Azienda Ospedaliero Universitaria Di Modena","AZIENDA OSPEDALIERO UNIVERSITARIA OSPEDALI RIUNITI UMBERTO I - G.M.LANCISI - G.SALESI","Azienda Ospedaliero Universitaria Di Modena",29,0.469,"2026-05-05 20:35:34 +0200","Skipped interactively"
"bracco imaging ||| bracco ||| bracco imaging ||| bracco","approved","Bracco Imaging","Bracco","Bracco Imaging","Bracco",29,0.429,"2026-05-05 20:35:36 +0200",""
"moorfields eye hospital ||| moorfields eye hospital nhs foundation trust ||| moorfields eye hospital ||| moorfields eye hospital nhs foundation trust","approved","Moorfields Eye Hospital","Moorfields Eye Hospital Nhs Foundation Trust","Moorfields Eye Hospital","Moorfields Eye Hospital Nhs Foundation Trust",28,1,"2026-05-05 20:35:39 +0200",""
"technische universitt dresden ||| technische universitt mnchen ||| technische universitt dresden ||| technische universitt mnchen","skipped","Technische Universitt Dresden","Technische Universitt Mnchen","Technische Universitt Dresden","Technische Universitt Mnchen",43,0.828,"2026-05-05 20:36:12 +0200","Skipped interactively"
"istituto scientifico romagnolo per lo studio e la cura dei tumori ||| istituto romagnolo per lo studio dei tumori dino amadori irst ||| istituto scientifico romagnolo per lo studio e la cura dei tumori ||| istituto romagnolo per lo studio dei tumori dino amadori irst","skipped","Istituto Scientifico Romagnolo Per Lo Studio E La Cura Dei Tumori","Istituto Romagnolo Per Lo Studio Dei Tumori Dino Amadori Irst","Istituto Scientifico Romagnolo Per Lo Studio E La Cura Dei Tumori","Istituto Romagnolo Per Lo Studio Dei Tumori Dino Amadori Irst",43,0.516,"2026-05-05 20:36:19 +0200","Skipped interactively"
"universitaetsklinikum heidelberg aör ||| heidelberg ||| universitaetsklinikum heidelberg aör ||| heidelberg","approved","Universitaetsklinikum Heidelberg Aör","Heidelberg","Universitaetsklinikum Heidelberg Aör","Heidelberg",40,0.286,"2026-05-05 20:36:21 +0200",""
"universittsklinikum ulm ||| universittsklinikum essen ||| universittsklinikum ulm ||| universittsklinikum essen","skipped","Universittsklinikum Ulm","Universittsklinikum Essen","Universittsklinikum Ulm","Universittsklinikum Essen",28,0.8,"2026-05-05 20:36:23 +0200","Skipped interactively"
"centre hospitalier regional de marseille ||| centre hospitalier regional universitaire ||| centre hospitalier regional de marseille ||| centre hospitalier regional universitaire","approved","Centre Hospitalier Regional De Marseille","Centre Hospitalier Regional Universitaire","Centre Hospitalier Regional De Marseille","Centre Hospitalier Regional Universitaire",28,0.763,"2026-05-05 20:36:25 +0200",""
"the medicines company ||| praxis precision medicines ||| the medicines company ||| praxis precision medicines","skipped","The Medicines Company","Praxis Precision Medicines","The Medicines Company","Praxis Precision Medicines",28,0.346,"2026-05-05 20:36:27 +0200","Skipped interactively"
"cancer ||| breast cancer study ibcsg ||| cancer ||| breast cancer study ibcsg","skipped","Cancer","Breast Cancer Study Ibcsg","Cancer","Breast Cancer Study Ibcsg",28,0.24,"2026-05-05 20:36:28 +0200","Skipped interactively"
"cancer ||| institut regional du cancer de montpellier ||| cancer ||| institut regional du cancer de montpellier","skipped","Cancer","Institut Regional Du Cancer De Montpellier","Cancer","Institut Regional Du Cancer De Montpellier",28,0.154,"2026-05-05 20:36:31 +0200","Skipped interactively"
"cancer ||| abcsg austrian breast colorectal cancer study ||| cancer ||| abcsg austrian breast colorectal cancer study","skipped","Cancer","Abcsg Austrian Breast Colorectal Cancer Study","Cancer","Abcsg Austrian Breast Colorectal Cancer Study",28,0.133,"2026-05-05 20:36:32 +0200","Skipped interactively"
"gruppo oncologico italiano di ricerca clinica goirc ||| gruppo oncologico italiano di ricerca ||| gruppo oncologico italiano di ricerca clinica goirc ||| gruppo oncologico italiano di ricerca","approved","Gruppo Oncologico Italiano Di Ricerca Clinica Goirc","Gruppo Oncologico Italiano Di Ricerca","Gruppo Oncologico Italiano Di Ricerca Clinica Goirc","Gruppo Oncologico Italiano Di Ricerca",27,0.708,"2026-05-05 20:36:35 +0200",""
"herlev hospital ||| herlev gentofte hospital ||| herlev hospital ||| herlev gentofte hospital","approved","Herlev Hospital","Herlev Gentofte Hospital","Herlev Hospital","Herlev Gentofte Hospital",27,0.625,"2026-05-05 20:36:37 +0200",""
"universita degli studi di napoli federico ii ||| universita degli studi di udine ||| universita degli studi di napoli federico ii ||| universita degli studi di udine","skipped","Universita Degli Studi Di Napoli Federico Ii","Universita Degli Studi Di Udine","Universita Degli Studi Di Napoli Federico Ii","Universita Degli Studi Di Udine",27,0.61,"2026-05-05 20:36:39 +0200","Skipped interactively"
"zambon ||| zambon spa ||| zambon ||| zambon spa","approved","Zambon","Zambon Spa","Zambon","Zambon Spa",27,0.6,"2026-05-05 20:36:40 +0200",""
"region ostergotland ||| region stergtland ||| region ostergotland ||| region stergtland","skipped","Region Ostergotland","Region Stergtland","Region Ostergotland","Region Stergtland",26,0.895,"2026-05-05 20:36:45 +0200","Skipped interactively"
"universittsklinikum mnster ||| universittsklinikum tbingen ||| universittsklinikum mnster ||| universittsklinikum tbingen","skipped","Universittsklinikum Mnster","Universittsklinikum Tbingen","Universittsklinikum Mnster","Universittsklinikum Tbingen",26,0.778,"2026-05-05 20:36:46 +0200","Skipped interactively"
"centre hospitalier regional et universitaire de brest ||| centre hospitalier universitaire de liege ||| centre hospitalier regional et universitaire de brest ||| centre hospitalier universitaire de liege","skipped","Centre Hospitalier Regional Et Universitaire De Brest","Centre Hospitalier Universitaire De Liege","Centre Hospitalier Regional Et Universitaire De Brest","Centre Hospitalier Universitaire De Liege",26,0.66,"2026-05-05 20:36:48 +0200","Skipped interactively"
"herlev hospital ||| herlev and gentofte hospital ||| herlev hospital ||| herlev and gentofte hospital","skipped","Herlev Hospital","Herlev And Gentofte Hospital","Herlev Hospital","Herlev And Gentofte Hospital",26,0.625,"2026-05-05 20:36:50 +0200","Skipped interactively"
"azienda ospedaliero universitaria ospedali riuniti umberto i - g.m.lancisi - g.salesi ||| azienda ospedaliero universitaria di cagliari ||| azienda ospedaliero universitaria ospedali riuniti umberto i - g.m.lancisi - g.salesi ||| azienda ospedaliero universitaria di cagliari","skipped","AZIENDA OSPEDALIERO UNIVERSITARIA OSPEDALI RIUNITI UMBERTO I - G.M.LANCISI - G.SALESI","Azienda Ospedaliero Universitaria Di Cagliari","AZIENDA OSPEDALIERO UNIVERSITARIA OSPEDALI RIUNITI UMBERTO I - G.M.LANCISI - G.SALESI","Azienda Ospedaliero Universitaria Di Cagliari",26,0.494,"2026-05-05 20:36:53 +0200","Skipped interactively"
"herlev hospital ||| department of surgery, herlev hospital ||| herlev hospital ||| department of surgery, herlev hospital","approved","Herlev Hospital","Department Of Surgery, Herlev Hospital","Herlev Hospital","Department Of Surgery, Herlev Hospital",26,0.441,"2026-05-05 20:36:55 +0200",""
"herlev hospital ||| department of , herlev gentofte hospital ||| herlev hospital ||| department of , herlev gentofte hospital","approved","Herlev Hospital","Department Of , Herlev Gentofte Hospital","Herlev Hospital","Department Of , Herlev Gentofte Hospital",26,0.429,"2026-05-05 20:36:59 +0200",""
"hospital universitario la paz ||| fundacin para la investigacin biomdica del hospital universitario la paz ||| hospital universitario la paz ||| fundacin para la investigacin biomdica del hospital universitario la paz","skipped","Hospital Universitario La Paz","Fundacin Para La Investigacin Biomdica Del Hospital Universitario La Paz","Hospital Universitario La Paz","Fundacin Para La Investigacin Biomdica Del Hospital Universitario La Paz",26,0.39,"2026-05-05 20:37:06 +0200","Skipped interactively"
"cancer ||| cancer institute ||| cancer ||| cancer institute","skipped","Cancer","Cancer Institute","Cancer","Cancer Institute",26,0.375,"2026-05-05 20:37:12 +0200","Skipped interactively"
"azienda ospedaliera universitaria careggi ||| azienda ospedaliero universitaria di modena ||| azienda ospedaliera universitaria careggi ||| azienda ospedaliero universitaria di modena","skipped","Azienda Ospedaliera Universitaria Careggi","Azienda Ospedaliero Universitaria Di Modena","Azienda Ospedaliera Universitaria Careggi","Azienda Ospedaliero Universitaria Di Modena",25,0.829,"2026-05-05 20:37:14 +0200","Skipped interactively"
"central manchester university hospitals nhs foundation trust ||| university of manchester ||| central manchester university hospitals nhs foundation trust ||| university of manchester","skipped","Central Manchester University Hospitals Nhs Foundation Trust","University Of Manchester","Central Manchester University Hospitals Nhs Foundation Trust","University Of Manchester",25,0.263,"2026-05-05 20:37:16 +0200","Skipped interactively"
"cancer ||| the clatterbridge cancer centre nhs foundation trust ||| cancer ||| the clatterbridge cancer centre nhs foundation trust","skipped","Cancer","The Clatterbridge Cancer Centre Nhs Foundation Trust","Cancer","The Clatterbridge Cancer Centre Nhs Foundation Trust",25,0.222,"2026-05-05 20:37:18 +0200","Skipped interactively"
"chu caen ||| chu de caen ||| chu caen ||| chu de caen","approved","Chu Caen","Chu De Caen","Chu Caen","Chu De Caen",24,1,"2026-05-05 20:37:22 +0200",""
"universita degli studi di napoli federico ii ||| universita' degli studi di torino ||| universita degli studi di napoli federico ii ||| universita' degli studi di torino","skipped","Universita Degli Studi Di Napoli Federico Ii","Universita' Degli Studi Di Torino","Universita Degli Studi Di Napoli Federico Ii","Universita' Degli Studi Di Torino",24,0.659,"2026-05-05 20:37:25 +0200","Skipped interactively"
"hospital sant joan de du ||| fundaci sant joan de du ||| hospital sant joan de du ||| fundaci sant joan de du","approved","Hospital Sant Joan De Du","Fundaci Sant Joan De Du","Hospital Sant Joan De Du","Fundaci Sant Joan De Du",24,0.619,"2026-05-05 20:37:27 +0200",""
"fundacin progreso y salud ||| fundacin pblica andaluza progreso y salud ||| fundacin progreso y salud ||| fundacin pblica andaluza progreso y salud","approved","Fundacin Progreso Y Salud","Fundacin Pblica Andaluza Progreso Y Salud","Fundacin Progreso Y Salud","Fundacin Pblica Andaluza Progreso Y Salud",24,0.61,"2026-05-05 20:37:30 +0200",""
"centre hospitalier regional et universitaire de brest ||| centre hospitalier universitaire de poitiers ||| centre hospitalier regional et universitaire de brest ||| centre hospitalier universitaire de poitiers","skipped","Centre Hospitalier Regional Et Universitaire De Brest","Centre Hospitalier Universitaire De Poitiers","Centre Hospitalier Regional Et Universitaire De Brest","Centre Hospitalier Universitaire De Poitiers",24,0.596,"2026-05-05 20:37:32 +0200","Skipped interactively"
"central manchester university hospitals nhs foundation trust ||| manchester university nhs foundation trust ||| central manchester university hospitals nhs foundation trust ||| manchester university nhs foundation trust","approved","Central Manchester University Hospitals Nhs Foundation Trust","Manchester University Nhs Foundation Trust","Central Manchester University Hospitals Nhs Foundation Trust","Manchester University Nhs Foundation Trust",24,0.553,"2026-05-05 20:37:40 +0200",""
"gercor ||| association gercor ||| gercor ||| association gercor","approved","Gercor","Association Gercor","Gercor","Association Gercor",24,0.333,"2026-05-05 20:37:42 +0200",""
"cancer ||| center for cancer immune therapy ||| cancer ||| center for cancer immune therapy","skipped","Cancer","Center For Cancer Immune Therapy","Cancer","Center For Cancer Immune Therapy",24,0.214,"2026-05-05 20:37:43 +0200","Skipped interactively"
"domp farmaceutici ||| dompe' farmaceutici ||| domp farmaceutici ||| dompe' farmaceutici","approved","Domp Farmaceutici","Dompe' Farmaceutici","Domp Farmaceutici","Dompe' Farmaceutici",23,0.944,"2026-05-05 20:37:45 +0200",""
"bial - portela ca ||| bial - portela c ||| bial - portela ca ||| bial - portela c","approved","Bial - Portela Ca","Bial - Portela C","Bial - Portela Ca","Bial - Portela C",23,0.933,"2026-05-05 20:37:47 +0200",""
"chru de brest ||| chu de brest ||| chru de brest ||| chu de brest","approved","Chru De Brest","Chu De Brest","Chru De Brest","Chu De Brest",23,0.9,"2026-05-05 20:37:50 +0200",""
"universittsklinikum essen ||| universitaetsklinikum essen aör ||| universittsklinikum essen ||| universitaetsklinikum essen aör","approved","Universittsklinikum Essen","Universitaetsklinikum Essen Aör","Universittsklinikum Essen","Universitaetsklinikum Essen Aör",23,0.833,"2026-05-05 20:37:53 +0200",""
"universittsklinikum essen ||| universittsklinikum tbingen ||| universittsklinikum essen ||| universittsklinikum tbingen","skipped","Universittsklinikum Essen","Universittsklinikum Tbingen","Universittsklinikum Essen","Universittsklinikum Tbingen",23,0.815,"2026-05-05 20:37:54 +0200","Skipped interactively"
"gentofte hospital ||| herlev gentofte hospital ||| gentofte hospital ||| herlev gentofte hospital","approved","Gentofte Hospital","Herlev Gentofte Hospital","Gentofte Hospital","Herlev Gentofte Hospital",23,0.708,"2026-05-05 20:37:55 +0200",""
"university hospital heidelberg ||| university of heidelberg ||| university hospital heidelberg ||| university of heidelberg","skipped","University Hospital Heidelberg","University Of Heidelberg","University Hospital Heidelberg","University Of Heidelberg",23,0.7,"2026-05-05 20:37:59 +0200","Skipped interactively"
